{
  "rater_id": "ROUND3A-DAVID-CALIBRATED-SOL-XHIGH-001",
  "rater_type": "DAVID_CALIBRATED_AI_SURROGATE",
  "provider": "OpenAI",
  "model": "gpt-5.6-sol",
  "reasoning": "xhigh",
  "codex_cli_version": "0.152.0",
  "session_id": "01a0645d-b07a-7241-b938-6d0399a626fe",
  "stage1_started_at": "2026-09-02T23:04:16.582Z",
  "stage1_completed_at": "2026-09-02T23:04:40.854Z",
  "stage2_started_at": "2026-09-02T23:09:20.101Z",
  "stage2_completed_at": "2026-09-02T23:13:44.637Z",
  "stage1_authorization_sha256": "a76c15c720b5a83e3a901729c289e3fdd8d509bac4a2d9872d9e5ffc6b44a5c8",
  "stage2_authorization_sha256": "37954a00f56892cd588f64ed1c3ed1df3a0308a086f9edf7b1b9abe8efd3446b",
  "stage1_command": "codex exec --model gpt-5.6-sol -c model_reasoning_effort=xhigh --strict-config --ignore-user-config --ignore-rules --sandbox read-only --skip-git-repo-check --json --output-schema runtime_surrogate_extraction_output.schema.json --output-last-message stage1_raw_output.json --cd EMPTY_ISOLATED_DIRECTORY -",
  "stage2_command": "codex exec resume --all --model gpt-5.6-sol -c model_reasoning_effort=xhigh -c sandbox_mode=read-only --strict-config --ignore-user-config --ignore-rules --json --output-schema runtime_surrogate_scoring_output.schema.json --output-last-message stage2_raw_output.json 01a0645d-b07a-7241-b938-6d0399a626fe -",
  "stage1_prompt_path": "results/round3_granite41_3b/stage1_prompt.txt",
  "stage2_prompt_path": "results/round3_granite41_3b/stage2_prompt.txt",
  "stage1_events_path": "results/round3_granite41_3b/stage1_events.jsonl",
  "stage2_events_path": "results/round3_granite41_3b/stage2_events.jsonl",
  "calibration_sha256": "bdceb675e9f6af3e288cea29564891c5769cf23e70ea43ad66ad2aa926f33228",
  "rubric_sha256": "385bb36679e7b5702ed2119864de922c31fb7723e19ec4781496e40c413fa306",
  "extraction_packet_sha256": "2168552a7acc449f890a171fa7280ba804f3843e262618ac39d24407ca96300d",
  "scoring_packet_sha256": "a2e3b0a1b223ad6c4cc1653dc569432b3a67b5e21b5985c039463a8b9fe532d9",
  "stage1_prompt_sha256": "642e64a4e0047211850d10176f9eb0ad7b455a8b95398adc96e6d509a63ed6b7",
  "stage2_prompt_sha256": "ac85e91cc2420249c1ffbb4c7b48a793627abf5d78ff1a71688ba535a8513577",
  "stage1_events_sha256": "c76469dbdae36548416a60dceef2a8d1c2e964602a8db29498f36eedef984875",
  "stage2_events_sha256": "8698f7375bbd2cf8e8891c7fbaf317592b00dd1e102c85539afa812038ae732c",
  "stage1_raw_output_sha256": "48432fefd149c4261a7e59424cfdb3b9395ff7ecef7d17129b20aeb50fd07a36",
  "stage2_raw_output_sha256": "04e52687dc5dfa3a3464e425bad13d681cf30b0eca4e4e3cd30c69d0d959c5a9",
  "runtime_extraction_schema_sha256": "eb56e2c047a74ffb06c2863c75a6363dd98cb7dad187b79c70547e2384ab294e",
  "runtime_scoring_schema_sha256": "0fe5efa3b0705cab678db39fcfa00937143b405d6ee0f1f98cf2a6938b97f017",
  "tool_calls_observed": 0
}
